{"format_name":"ReplayResult","format_version":"1.0.0","feature_id":"holdout-01","fixture_digest":"f4b64bf0ea74013714b163cf89e74a6716ec9c87107b3cd86fe33adc971ea581","evaluated_package_digest":"6ff05a923d5bba51ba2b3e11d297b39f0a2c0b621f3ea8427e5261a23fe45733","investigator_id":"contract-fixture-investigator-one","reviewer_id":"contract-fixture-reviewer-one","contexts_isolated":true,"predicted_repositories":["feature-delivery-intelligence","feature-repo-scan"],"predicted_surfaces":[{"surface_id":"predicted-one-context","repository_id":"feature-delivery-intelligence","path":"docs/superpowers/specs/2026-08-29-fdi-context-taxonomy-design.md","symbol_or_anchor":"Evidence identity"},{"surface_id":"predicted-one-schema","repository_id":"feature-repo-scan","path":"schemas/evidence.schema.json","symbol_or_anchor":null}],"predicted_interface_ids":["interface-evidence-record"],"predicted_validation_ids":["validation-evidence-schema"],"required_claims":[{"claim_id":"claim-one-scope","classification":"REQUIRED","evidence_refs":["evidence-pinned-sources"],"current_authority":true,"backlinks_complete":true}],"closure_status":"CLOSED_WITHIN_DECLARED_SCOPE","review_verdict":"PASS","explicit_material_unknowns":[],"observations":{"execution_class":"CONTRACT_FIXTURE_NOT_BLIND_REPLAY","elapsed_ms":0}}
