{"format_name":"ReplayResult","format_version":"1.0.0","feature_id":"holdout-02","fixture_digest":"87da1836b8657537ba7a2e4a38d39699b15aa3c3682e09abbe8771d83e145a72","evaluated_package_digest":"6ff05a923d5bba51ba2b3e11d297b39f0a2c0b621f3ea8427e5261a23fe45733","investigator_id":"contract-fixture-investigator-two","reviewer_id":"contract-fixture-reviewer-two","contexts_isolated":true,"predicted_repositories":["feature-delivery-intelligence","feature-repo-scan"],"predicted_surfaces":[{"surface_id":"predicted-two-workflow","repository_id":"feature-delivery-intelligence","path":"docs/superpowers/specs/2026-08-29-fdi-workflow-semantics-design.md","symbol_or_anchor":"Change Set"},{"surface_id":"predicted-two-cli","repository_id":"feature-repo-scan","path":"src/main/java/com/featuretorepo/cli/BlindClosureCommand.java","symbol_or_anchor":"BlindClosureCommand"}],"predicted_interface_ids":["interface-replay-input"],"predicted_validation_ids":["validation-cli-contract"],"required_claims":[{"claim_id":"claim-two-scope","classification":"REQUIRED","evidence_refs":["evidence-pinned-sources"],"current_authority":true,"backlinks_complete":true}],"closure_status":"CLOSED_WITHIN_DECLARED_SCOPE","review_verdict":"PASS","explicit_material_unknowns":[],"observations":{"execution_class":"CONTRACT_FIXTURE_NOT_BLIND_REPLAY","elapsed_ms":0}}
