{"format_name":"ReplayResult","format_version":"1.0.0","feature_id":"calibration-01","fixture_digest":"3e0c3439c295fe80fe7a991083d4363d8aaab73ee97d5c4f35c45089c1925748","evaluated_package_digest":"6ff05a923d5bba51ba2b3e11d297b39f0a2c0b621f3ea8427e5261a23fe45733","investigator_id":"contract-fixture-investigator","reviewer_id":"contract-fixture-reviewer","contexts_isolated":true,"predicted_repositories":["feature-delivery-intelligence","feature-repo-scan"],"predicted_surfaces":[{"surface_id":"predicted-calibration-framework","repository_id":"feature-delivery-intelligence","path":"docs/superpowers/specs/2026-08-29-fdi-workflow-semantics-design.md","symbol_or_anchor":"artifact contract"},{"surface_id":"predicted-calibration-schema","repository_id":"feature-repo-scan","path":"schemas/change-plan.schema.json","symbol_or_anchor":null}],"predicted_interface_ids":["interface-closure-record"],"predicted_validation_ids":["validation-schema"],"required_claims":[{"claim_id":"claim-calibration-scope","classification":"REQUIRED","evidence_refs":["evidence-pinned-sources"],"current_authority":true,"backlinks_complete":true}],"closure_status":"CLOSED_WITHIN_DECLARED_SCOPE","review_verdict":"PASS","explicit_material_unknowns":[],"observations":{"execution_class":"CONTRACT_FIXTURE_NOT_BLIND_REPLAY","elapsed_ms":0}}
