{"format_name":"ReplayResult","format_version":"1.0.0","feature_id":"holdout-04","fixture_digest":"b7118b5fd6780e2f71beb66b034900682391456d4dd164d1e4d91ea7e600f1e6","evaluated_package_digest":"6ff05a923d5bba51ba2b3e11d297b39f0a2c0b621f3ea8427e5261a23fe45733","investigator_id":"contract-fixture-investigator-four","reviewer_id":"contract-fixture-reviewer-four","contexts_isolated":true,"predicted_repositories":["feature-delivery-intelligence","feature-repo-scan"],"predicted_surfaces":[{"surface_id":"predicted-four-selector","repository_id":"feature-delivery-intelligence","path":"docs/superpowers/specs/2026-08-29-fdi-workflow-semantics-design.md","symbol_or_anchor":"Bounded selected-read grammar"},{"surface_id":"predicted-four-skill","repository_id":"feature-repo-scan","path":"skill/feature-to-multi-repo/SKILL.md","symbol_or_anchor":"Procedure"}],"predicted_interface_ids":["interface-selector-policy"],"predicted_validation_ids":["validation-trigger-boundary"],"required_claims":[{"claim_id":"claim-four-scope","classification":"REQUIRED","evidence_refs":["evidence-pinned-sources"],"current_authority":true,"backlinks_complete":true}],"closure_status":"CLOSED_WITHIN_DECLARED_SCOPE","review_verdict":"PASS","explicit_material_unknowns":[],"observations":{"execution_class":"CONTRACT_FIXTURE_NOT_BLIND_REPLAY","elapsed_ms":0}}
