{"format_name":"ReplayResult","format_version":"1.0.0","feature_id":"holdout-03","fixture_digest":"f26365712d36b6de48bea412966d4168ae01ad39a73315688685450b4cdfbd8d","evaluated_package_digest":"6ff05a923d5bba51ba2b3e11d297b39f0a2c0b621f3ea8427e5261a23fe45733","investigator_id":"contract-fixture-investigator-three","reviewer_id":"contract-fixture-reviewer-three","contexts_isolated":true,"predicted_repositories":["feature-delivery-intelligence","feature-repo-scan"],"predicted_surfaces":[{"surface_id":"predicted-three-context","repository_id":"feature-delivery-intelligence","path":"docs/superpowers/specs/2026-08-29-fdi-context-taxonomy-design.md","symbol_or_anchor":"Multi-repository ownership boundaries"}],"predicted_interface_ids":["interface-closure-state"],"predicted_validation_ids":["validation-workflow-state"],"required_claims":[{"claim_id":"claim-three-known-gap","classification":"REQUIRED","evidence_refs":["evidence-pinned-context"],"current_authority":true,"backlinks_complete":true}],"closure_status":"PARTIAL","review_verdict":"FAIL","explicit_material_unknowns":["surface-feature-closure-workflow"],"observations":{"execution_class":"CONTRACT_FIXTURE_NOT_BLIND_REPLAY","elapsed_ms":0}}
